{
  "artifacts": {
    "feature_matrix": "feature-matrix.md",
    "findings": "findings.json",
    "manifest": "result-manifest.json",
    "report": "audit-report.md",
    "summary": "audit-summary.md",
    "system_coverage": null
  },
  "audit": {
    "audit_id": "v294-git-sealed",
    "finished_at": "2026-09-23T13:51:42.047622+00:00",
    "gate": "PASSED",
    "mode": "FEATURE",
    "started_at": "2026-09-23T13:51:42.034633+00:00",
    "status": "COMPLETE"
  },
  "coverage": {
    "audited": 1,
    "completed_required_probes": 6,
    "discovered": 1,
    "excluded": 0,
    "in_scope": 1,
    "planned": 1,
    "required_probes": 6,
    "unmapped": 0
  },
  "features": [
    {
      "claim": "feature has real effect",
      "feature_id": "feature",
      "finding_ids": [],
      "implementation_patterns": [],
      "probe_summary": {
        "required_missing": [],
        "terminal_attempts": 6
      },
      "verdict": "NOT_FALSIFIED"
    }
  ],
  "findings": [],
  "hypotheses": [],
  "integrity": {
    "attempt_chain_head": "bf324ad3789d84f62926b0e1b677e452129df9a04ade3b89f1bccb31b6e2e5a9",
    "canonicalization": "RFC8785-JCS-float-free-profile",
    "hypothesis_chain_head": "",
    "inventory_sha256": null,
    "plan_sha256": "131c6fc277a511fa9f2e08558a5ceeb170257d934999c19bec8f245e48c93093"
  },
  "preflight": {
    "environment_collision": {
      "attempt_count": 1,
      "status": "SURVIVED"
    },
    "environment_start": {
      "attempt_count": 1,
      "status": "SURVIVED"
    },
    "runtime_identity": {
      "attempt_count": 1,
      "status": "SURVIVED"
    }
  },
  "producer": {
    "name": "runtime-feature-falsifier",
    "version": "2.9.4"
  },
  "schema_version": "1.0.0",
  "target": {
    "environment": "local",
    "git_commit": "10945e3a85a968022a6cd857b25b095734bc21e8",
    "output_root": null,
    "path_warnings": [],
    "project": "demo",
    "run_id": "v294-git-sealed",
    "runtime_identity_expectation": "demo service",
    "scope": "feature",
    "startup_path": "demo --serve"
  },
  "verdict_counts": {
    "BLOCKED": 0,
    "FALSIFIED": 0,
    "INCOMPLETE": 0,
    "INCONCLUSIVE": 0,
    "NOT_FALSIFIED": 1
  }
}
