{
  "artifacts": {
    "feature_matrix": "feature-matrix.md",
    "findings": "findings.json",
    "manifest": "result-manifest.json",
    "report": "audit-report.md",
    "summary": "audit-summary.md",
    "system_coverage": null
  },
  "audit": {
    "audit_id": "legacy-v292",
    "finished_at": "2026-09-23T08:22:06.635489+00:00",
    "gate": "PASSED",
    "mode": "FEATURE",
    "started_at": "2026-09-23T08:22:06.622920+00:00",
    "status": "COMPLETE"
  },
  "coverage": {
    "audited": 1,
    "completed_required_probes": 6,
    "discovered": 1,
    "excluded": 0,
    "in_scope": 1,
    "planned": 1,
    "required_probes": 6,
    "unmapped": 0
  },
  "features": [
    {
      "claim": "feature has real effect",
      "feature_id": "feature",
      "finding_ids": [],
      "implementation_patterns": [],
      "probe_summary": {
        "required_missing": [],
        "terminal_attempts": 6
      },
      "verdict": "NOT_FALSIFIED"
    }
  ],
  "findings": [],
  "hypotheses": [],
  "integrity": {
    "attempt_chain_head": "61157ed8d4113384d0b244a503b040e9d721ebbb60a4afd3a5bc61fa662f288a",
    "canonicalization": "RFC8785-JCS-float-free-profile",
    "hypothesis_chain_head": "",
    "inventory_sha256": null,
    "plan_sha256": "7dda81341d30749a26b5119602458911c43734d27b180c1e91f522ad52da1900"
  },
  "preflight": {
    "environment_collision": {
      "attempt_count": 1,
      "status": "SURVIVED"
    },
    "environment_start": {
      "attempt_count": 1,
      "status": "SURVIVED"
    },
    "runtime_identity": {
      "attempt_count": 1,
      "status": "SURVIVED"
    }
  },
  "producer": {
    "name": "runtime-feature-falsifier",
    "version": "2.9.2"
  },
  "schema_version": "1.0.0",
  "target": {
    "environment": "local",
    "git_commit": null,
    "output_root": null,
    "path_warnings": [],
    "project": "demo",
    "run_id": "legacy-v292",
    "runtime_identity_expectation": "demo service",
    "scope": "feature",
    "startup_path": "demo --serve"
  },
  "verdict_counts": {
    "BLOCKED": 0,
    "FALSIFIED": 0,
    "INCOMPLETE": 0,
    "INCONCLUSIVE": 0,
    "NOT_FALSIFIED": 1
  }
}
